{
  "$schema": "http://json-schema.org/draft-04/schema#",
  "$id": "https://stash.sd.apple.com/coreos/libmicro/libmicro-schema.json",
  "title": "libMicro",
  "description": "Describes a libMicro workload configuration",
  "type": "object",
  "required": [
    "name",
    "version",
    "description",
    "defaults",
    "tests"
  ],
  "additionalProperties": false,
  "properties": {
    "$schema": {
       "type": "string",
       "description": "schema the file conforms to"
    },
    "name": {
      "type": "string",
      "description": "name of the libMicro workload"
    },
    "version": {
      "type": "integer",
      "minimum": 0,
      "description": "Version of the libMicro workload. Allows workloads to keep the same name while having a different configuration"
    },
    "description": {
      "type": "string",
      "description": "Description of the libMicro workload"
    },
    "comments": {
      "type": "string",
      "description": "Comments on the workload"
    },
    "defaults": {
      "type": "object",
      "description": "default arguments passed to all tests in the workload"
    },
    "tests": {
      "type": "array",
      "description": "array containing tests to run",
      "items": {
        "$ref": "#/definitions/test"
      },
      "minItems": 1
    }
  },
  "definitions": {
    "test": {
      "type": "object",
      "allOf": [
        {
          "required": [
            "name",
            "cases"
          ],
          "properties": {
            "name": {
              "type": "string",
              "description": "semantic name of the libMicro test to run"
            },
            "binary": {
              "type": "string",
              "description": "name of the binary that will be run. If not set, name will be used",
              "default": "#name"
            },
            "defaults": {
              "type": "object",
              "description": "default arguments passed to all cases in the test. Overwrites global defaults"
            },
            "weight": {
              "type": "integer",
              "description": "weight of the test for calculation of the overall score",
              "minimum": 1
            },
            "cases": {
              "type": "array",
              "description": "list of the test cases (specified by a list of arguments passed to the test) that will be run",
              "items": {
                "type": "object",
                "properties": {
                  "baseline": {
                    "type": "number",
                    "description": "baseline value for a 1000 score",
                    "minimum": 0,
                    "exclusiveMinimum": true
                  }
                },
                "additionalProperties": true
              },
              "minItems": 1
            },
            "comments": {
              "type": "string"
            }
          }
        }
      ]
    }
  }
}
